{
  "id": "impacket-GetLAPSPassword",
  "name": "Impacket GetLAPSPassword",
  "command": "impacket-GetLAPSPassword '<domain>/<user>:<password>' -dc-ip '<ip>'",
  "description": "Retrieve LAPS managed local administrator passwords from Active Directory",
  "platform": "linux",
  "requires": [
    "password"
  ],
  "protocols": [
    "ldap"
  ],
  "tags": [
    "impacket",
    "laps",
    "local-admin",
    "credential-dumping",
    "ldap"
  ],
  "variations": [
    {
      "label": "NTLM Hash",
      "requires": "hash",
      "command": "impacket-GetLAPSPassword -hashes ':<hash>' -dc-ip '<ip>' '<domain>/<user>'"
    },
    {
      "label": "Kerberos Ticket",
      "requires": "ticket",
      "command": "impacket-GetLAPSPassword -k -no-pass -dc-ip '<ip>' '<domain>/<user>'"
    }
  ],
  "examples": [
    "impacket-GetLAPSPassword 'CORP.LOCAL/user:password' -dc-ip '192.168.1.100'"
  ]
}
