{
  "id": "bloodyad-get-writable",
  "name": "bloodyAD get writable",
  "command": "bloodyAD --host <dc-ip> -d '<domain>' -u '<user>' -p '<password>' get writable",
  "description": "Enumerate every AD object the current principal can write to — fastest path to finding ACL escalation primitives without round-tripping through BloodHound. Filter with --otype/--right for targeted hunts.",
  "platform": "linux",
  "requires": ["password"],
  "protocols": ["ldap"],
  "tags": ["bloodyad", "acl", "writable", "enumeration"],
  "variations": [
    { "label": "Users Only", "requires": "password", "command": "bloodyAD --host <dc-ip> -d '<domain>' -u '<user>' -p '<password>' get writable --otype USER" },
    { "label": "WriteOwner Rights", "requires": "password", "command": "bloodyAD --host <dc-ip> -d '<domain>' -u '<user>' -p '<password>' get writable --right WriteOwner" }
  ],
  "examples": [
    "bloodyAD --host 10.10.10.10 -d corp.local -u jdoe -p 'Password123!' get writable"
  ]
}
