{
  "id": "nxc-smb-groups",
  "name": "NetExec SMB Enumerate Groups",
  "command": "nxc smb '<ip>' -u '<user>' -p '<password>' --groups",
  "description": "Enumerate domain groups via SMB",
  "platform": "linux",
  "requires": [
    "password"
  ],
  "protocols": [
    "smb"
  ],
  "tags": [
    "nxc",
    "smb",
    "groups",
    "enumeration",
    "ad"
  ],
  "variations": [
    {
      "label": "NTLM Hash",
      "requires": "hash",
      "command": "nxc smb '<ip>' -u '<user>' -H '<hash>' --groups"
    },
    {
      "label": "Kerberos Ticket",
      "requires": "ticket",
      "command": "nxc smb '<ip>' -u '<user>' --use-kcache --groups"
    }
  ],
  "examples": [
    "nxc smb '192.168.1.100' -u 'user' -p 'password' --groups"
  ]
}
